{
  "schema_version": "1.0.0",
  "harness_version": "1.0.0",
  "run": {"id": "20260804T231158Z-coreml", "recorded_at": "2026-08-04T23:11:58.809233+00:00", "status": "completed"},
  "environment": {"os": "Darwin", "os_release": "25.6.0", "architecture": "arm64", "python": "3.12.13", "cpu": "arm", "logical_cpu_count": 12, "memory_bytes": 34359738368, "dependencies": {"fastembed": "0.8.0", "numpy": "2.2.6", "onnxruntime": "1.22.1", "psutil": "7.1.3"}},
  "backend": {"name": "onnxruntime-coreml", "device": "coreml", "model": "bge-small", "precision": "float32", "dimensions": 384},
  "fixture": {"manifest_version": "1.0.0", "manifest_sha256": "da62785afe275cff1b607cebb62f415a9c21089c842a4fe18a86c45e8199e165", "length_classes": ["long", "medium", "oversized", "short"], "unique_texts": 4, "total_texts": 15},
  "performance": {"cold_start_seconds": 0.502563416986959, "warm_total_seconds": 0.45352770897443406, "warm_iterations": 1, "throughput_texts_per_second": 33.07405413865367, "latency_seconds": {"samples": [0.45352770897443406], "p50": 0.45352770897443406, "p95": 0.45352770897443406}, "peak_rss_bytes": 72482816, "compiled_cache_reused": false, "compiled_cache_entries_created": 0, "cpu_cold_start_seconds": 0.08197491598548368, "cpu_warm_seconds": 0.4467268750013318, "speedup_over_cpu": 0.9850045899323747},
  "reliability": {"attempted_batches": 3, "completed_batches": 3, "failures": 0, "fallbacks": 0, "restarts": 0, "completed_soak_texts": 0},
  "correctness": {"reference_backend": "onnxruntime-cpu", "shape": [15, 384], "finite": true, "max_absolute_error": 0.0, "mean_absolute_error": 0.0, "minimum_cosine_similarity": 1.0, "passed": true},
  "qualification": {"decision": "experimental", "reason": "speedup=0.985; numerical_pass=True; soak_texts=0/100000; placement=hybrid-coreml-cpu", "speedup_gate": 1.25, "soak_target_batches": null, "soak_target_texts": 100000, "soak_target_seconds": 10800, "provider_options": {"ModelFormat": "MLProgram", "RequireStaticInputShapes": "1", "ModelCacheDirectory": "/private/tmp/arcaneum-coreml-2mxd", "SpecializationStrategy": "FastPrediction", "ProfileComputePlan": "1"}, "provider_placement": "hybrid-coreml-cpu", "providers_reported": ["CoreMLExecutionProvider", "CPUExecutionProvider"], "buckets_used": [16], "static_shape_scope": "batch-count buckets; tokenizer sequence shape is dynamic", "exact_rerun": "ARC_RUN_COREML_QUALIFICATION=1 PYTHONPATH=$PWD/src python scripts/benchmark_accelerators.py --backend coreml --model bge-small --output benchmarks/results/coreml-local.json"}
}
